reports/all_monthly_runs_clob_systematic/all_monthly_clob_strategy_summary.csv

source_layer,strategy,sizing,trades,ending_bankroll,total_return,avg_trade_return_on_cost,median_trade_return_on_cost,win_rate,profit_factor,max_drawdown,max_consecutive_losses,avg_entry_minute,avg_signal_score,p10_trade_return_on_cost,score_end,score_win,score_pf,score_dd,score_streak,score_tail,robustness_score
all_monthly_clob_systematic,state_selector_robust,fixed_10pct,5350,12172.766709998845,120.72766709998845,0.05749041118197239,0.23749999999999993,0.7340186915887851,1.491867067792346,0.9998803618337689,5,1.679252336448598,0.06939133905648993,-1.0158730158730158,1.0,0.578125,0.875,0.84375,0.828125,0.578125,0.8
all_monthly_clob_systematic,static_m4_breakout_up_tight,fixed_20pct,556,10951.668068719067,108.51668068719067,0.4037552852173163,0.16470588235294117,0.8201438848920863,4.498650044546854,0.9922793293296549,4,4.0,,-1.0125791139240508,0.96875,0.953125,0.9375,0.9375,0.953125,0.9375,0.9484375
all_monthly_clob_systematic,static_m4_breakout_up_tight,fixed_15pct,556,10840.885212324962,107.40885212324962,0.4037552852173163,0.16470588235294117,0.8201438848920863,4.517498081829901,0.9627533034868898,4,4.0,,-1.0125791139240508,0.9375,0.953125,0.96875,0.96875,0.953125,0.9375,0.9546875
all_monthly_clob_systematic,static_m4_breakout_up_tight,fixed_25pct,556,10494.52906539664,103.94529065396641,0.4037552852173163,0.16470588235294117,0.8201438848920863,4.289548231218689,0.9987886493449198,4,4.0,,-1.0125791139240508,0.90625,0.953125,0.90625,0.90625,0.953125,0.9375,0.9234375000000001
all_monthly_clob_systematic,static_m4_breakout_up_tight,fixed_10pct,556,10151.179614280467,100.51179614280467,0.4037552852173163,0.16470588235294117,0.8201438848920863,4.523214617282947,0.8603584498742126,4,4.0,,-1.0125791139240505,0.875,0.953125,1.0,1.0,0.953125,1.0,0.9609375
all_monthly_clob_systematic,state_selector_robust,fixed_15pct,5350,496.3934599126122,3.963934599126122,0.05749041118197237,0.2374999999999999,0.7340186915887851,1.1762223370930958,0.9999999680088111,5,1.679252336448598,0.06939133905648993,-1.0158730158730158,0.84375,0.578125,0.84375,0.78125,0.828125,0.578125,0.75
all_monthly_clob_systematic,static_m2_milddrop_down_book,fixed_10pct,3183,0.031536971336652064,-0.9996846302866335,0.003567878341552105,0.2692307692307692,0.6808042726987119,0.927027738442359,0.9998740415483653,6,2.0,,-1.0166666666666666,0.8125,0.453125,0.65625,0.875,0.640625,0.453125,0.6687500000000001
all_monthly_clob_systematic,static_m1_drop20_down,fixed_10pct,9090,0.012200305986256568,-0.9998779969401375,0.011535736659390498,0.23749999999999993,0.7392739273927392,0.9958924987692682,0.9999999318966681,7,1.0,,-1.0149253731343284,0.78125,0.703125,0.8125,0.8125,0.453125,0.703125,0.7374999999999999
all_monthly_clob_systematic,state_selector_robust,fixed_20pct,5350,0.000675372320395367,-0.9999932462767961,0.05749041118197239,0.23749999999999993,0.7340186915887851,0.8210840435345024,0.9999999999999467,5,1.679252336448598,0.06939133905648993,-1.0158730158730158,0.75,0.578125,0.375,0.6875,0.828125,0.578125,0.6187500000000001
all_monthly_clob_systematic,static_m2_milddrop_down_book,fixed_15pct,3183,3.999463846140516e-07,-0.9999999960005361,0.003567878341552104,0.2692307692307692,0.6808042726987119,0.931264951349622,0.999999998627332,6,2.0,,-1.0166666666666666,0.71875,0.453125,0.6875,0.75,0.640625,0.453125,0.6312500000000001
all_monthly_clob_systematic,static_m2_drop10_down_liq,fixed_10pct,10309,1.6451601505388357e-07,-0.9999999983548399,-0.00030811801671511,0.13793103448275862,0.7747599185178,0.8729809229794067,0.9999999989297494,6,2.0,,-1.0144927536231882,0.6875,0.828125,0.59375,0.71875,0.640625,0.828125,0.7125000000000001
all_monthly_clob_systematic,static_m1_drop20_down,fixed_15pct,9090,4.113485645507671e-11,-0.9999999999995887,0.011535736659390498,0.23749999999999993,0.7392739273927392,0.9942068003186723,0.9999999999999997,7,1.0,,-1.0149253731343284,0.65625,0.703125,0.78125,0.65625,0.453125,0.703125,0.6749999999999999
all_monthly_clob_systematic,state_selector_robust,fixed_25pct,5350,1.321748301446546e-13,-0.9999999999999987,0.05749041118197239,0.2374999999999999,0.7340186915887851,0.7499076015012697,1.0,5,1.679252336448598,0.06939133905648993,-1.0158730158730158,0.625,0.578125,0.0625,0.3125,0.828125,0.578125,0.45625
all_monthly_clob_systematic,static_m2_milddrop_down_book,fixed_20pct,3183,3.2404197583330133e-14,-0.9999999999999997,0.0035678783415521065,0.2692307692307692,0.6808042726987119,0.9320880242423281,0.9999999999999998,6,2.0,,-1.0166666666666666,0.59375,0.453125,0.71875,0.625,0.640625,0.453125,0.5875
all_monthly_clob_systematic,static_m2_sharpdrop_up_liq,fixed_10pct,2564,1.6574327386942588e-17,-1.0,0.08749404391718037,-1.0434782608695652,0.20982839313572543,0.8290391964527242,1.0,29,2.0,,-1.1,0.5625,0.203125,0.40625,0.3125,0.203125,0.203125,0.3375
all_monthly_clob_systematic,static_m2_drop10_down_liq,fixed_15pct,10309,1.2801901005349956e-18,-1.0,-0.00030811801671511,0.13793103448275862,0.7747599185178,0.8354811783474517,1.0,6,2.0,,-1.0144927536231882,0.53125,0.828125,0.4375,0.3125,0.640625,0.828125,0.5687500000000001
all_monthly_clob_systematic,static_m2_milddrop_down_book,fixed_25pct,3183,1.0815330465290232e-23,-1.0,0.0035678783415521065,0.2692307692307692,0.6808042726987119,0.921880166605425,1.0,6,2.0,,-1.0166666666666666,0.5,0.453125,0.625,0.3125,0.640625,0.453125,0.48750000000000004
all_monthly_clob_systematic,static_m1_drop20_down,fixed_20pct,9090,1.2330971974244488e-24,-1.0,0.011535736659390495,0.23749999999999993,0.7392739273927392,0.9614635292292454,1.0,7,1.0,,-1.0149253731343284,0.46875,0.703125,0.75,0.3125,0.453125,0.703125,0.5625
all_monthly_clob_systematic,state_selector_pnl,fixed_10pct,10416,3.072597256433464e-29,-1.0,0.029609637940281035,0.11235955056179774,0.5989823348694316,0.7811144475166466,1.0,13,1.8291090629800306,0.045541101408258226,-1.0714285714285714,0.4375,0.328125,0.25,0.3125,0.328125,0.328125,0.33125000000000004
all_monthly_clob_systematic,static_m2_drop10_down_liq,fixed_20pct,10309,1.5010181381788075e-34,-1.0,-0.00030811801671511,0.13793103448275862,0.7747599185178,0.7657811584398174,1.0,6,2.0,,-1.0144927536231882,0.40625,0.828125,0.125,0.3125,0.640625,0.828125,0.48125000000000007
all_monthly_clob_systematic,static_m2_sharpdrop_up_liq,fixed_15pct,2564,1.7195636813512165e-41,-1.0,0.08749404391718038,-1.0434782608695652,0.20982839313572543,0.8554322004902474,1.0,29,2.0,,-1.1,0.375,0.203125,0.5,0.3125,0.203125,0.203125,0.31875000000000003
all_monthly_clob_systematic,static_m1_drop20_down,fixed_25pct,9090,3.2048364754879394e-44,-1.0,0.011535736659390497,0.23749999999999993,0.7392739273927392,0.8522911164450991,1.0,7,1.0,,-1.0149253731343284,0.34375,0.703125,0.46875,0.3125,0.453125,0.703125,0.48124999999999996
all_monthly_clob_systematic,static_m2_drop10_down_liq,fixed_25pct,10309,1.0969429688720158e-55,-1.0,-0.0003081180167151073,0.13793103448275862,0.7747599185178,0.6555208380018032,1.0,6,2.0,,-1.0144927536231882,0.3125,0.828125,0.03125,0.3125,0.640625,0.828125,0.44375000000000003
all_monthly_clob_systematic,state_selector_pnl,fixed_15pct,10416,2.0688433069629007e-67,-1.0,0.029609637940281035,0.11235955056179774,0.5989823348694316,0.7823524637045176,1.0,13,1.8291090629800306,0.045541101408258226,-1.0714285714285714,0.28125,0.328125,0.28125,0.3125,0.328125,0.328125,0.30625
all_monthly_clob_systematic,static_m2_sharpdrop_up_liq,fixed_20pct,2564,6.119218141949156e-73,-1.0,0.08749404391718038,-1.0434782608695654,0.20982839313572543,0.8636512287684429,1.0,29,2.0,,-1.1,0.25,0.203125,0.5625,0.3125,0.203125,0.203125,0.30625
all_monthly_clob_systematic,static_m2_extremeup_fade_down,fixed_10pct,3763,2.6961171586441307e-88,-1.0,-0.19489302585912358,-1.1,0.09380813180972629,0.7558458948530651,1.0,64,2.0,,-1.3333333333333333,0.21875,0.09375,0.09375,0.3125,0.078125,0.078125,0.159375
all_monthly_clob_systematic,static_m2_sharpdrop_up_liq,fixed_25pct,2564,2.1346646597608356e-111,-1.0,0.08749404391718038,-1.0434782608695652,0.20982839313572543,0.8597373832754506,1.0,29,2.0,,-1.1,0.1875,0.203125,0.53125,0.3125,0.203125,0.203125,0.28750000000000003
all_monthly_clob_systematic,state_selector_pnl,fixed_20pct,10416,2.1899394711002376e-118,-1.0,0.029609637940281024,0.11235955056179774,0.5989823348694316,0.7807763229560292,1.0,13,1.8291090629800306,0.045541101408258226,-1.0714285714285714,0.15625,0.328125,0.1875,0.3125,0.328125,0.328125,0.2625
all_monthly_clob_systematic,static_m2_extremeup_fade_down,fixed_15pct,3763,2.6679844511257694e-159,-1.0,-0.19489302585912358,-1.1,0.09380813180972629,0.7776396515791895,1.0,64,2.0,,-1.3333333333333333,0.125,0.09375,0.15625,0.3125,0.078125,0.078125,0.153125
all_monthly_clob_systematic,state_selector_pnl,fixed_25pct,10416,4.7843640078571566e-182,-1.0,0.029609637940281024,0.11235955056179774,0.5989823348694316,0.7810435526468503,1.0,13,1.8291090629800306,0.045541101408258226,-1.0714285714285714,0.09375,0.328125,0.21875,0.3125,0.328125,0.328125,0.25625000000000003
all_monthly_clob_systematic,static_m2_extremeup_fade_down,fixed_20pct,3763,2.1950406404953377e-243,-1.0,-0.19489302585912358,-1.1,0.09380813180972629,0.7922585340820478,1.0,64,2.0,,-1.3333333333333333,0.0625,0.09375,0.3125,0.3125,0.078125,0.078125,0.171875
all_monthly_clob_systematic,static_m2_extremeup_fade_down,fixed_25pct,3588,1e-323,-1.0,-0.19577461447437347,-1.1,0.09308807134894091,0.8002132636334647,1.0,64,2.0,,-1.3333333333333333,0.03125,0.03125,0.34375,0.3125,0.078125,0.078125,0.159375

reports/all_monthly_runs_clob_systematic/all_monthly_clob_strategy_report.md

## 两种“最佳”

- 收益最高：**state_selector_robust | fixed_10pct**，期末本金 **12172.77 USD**，最大回撤 **99.99%**。
- 稳健性最好：**static_m4_breakout_up_tight | fixed_10pct**，稳健得分 **0.9609**，期末本金 **10151.18 USD**，最大回撤 **86.04%**。